Job_Title,Salary_Estimate,Job_Description,Rating,Company_Name,Location,Headquarters,Size,Founded,Type_Of_Ownership,Industry,Sector,Revenue,Competitors,Hourly,min_salary,max_salary,average_salary,job_state,age_of_company,python_jd,spark_jd,excel,aws
Data Scientist - Nationwide Opportunities,64 - 118 ,"Bachelor’s degree in a highly quantitative field (Computer Science, Machine Learning, Operational Research, Statistics, Mathematics, etc.) or equivalent professional or military experience
Experience with ML fields, e.g., natural language processing, computer vision, statistical learning theory
4+ years of industry experience in predictive modeling, data science, and analysis
Experience in an ML engineer or data scientist role building and deploying ML models or hands on experience developing deep learning models
Experience writing code in Python, R, Scala, Java, C++ with documentation for reproducibility
Experience handling terabyte size datasets, diving into data to discover hidden patterns, using data visualization tools, writing SQL, and working with GPUs to develop models
Experience writing and speaking about technical concepts to business, technical, and lay audiences and giving data-driven presentations
Want to help the largest global enterprises derive business value through the adoption of Artificial Intelligence (AI) and Machine Learning (ML)? Excited by using massive amounts of disparate data to develop ML models? Eager to learn to apply ML to a diverse array of enterprise use cases? Thrilled to be a part of Amazon who has been pioneering and shaping the world’s AI/ML technology for decades?

At Amazon Web Services (AWS), we are helping large enterprises build ML models on the AWS Cloud. We are applying predictive technology to large volumes of data and against a wide spectrum of problems. AWS Professional Services works together with AWS customers to address their business needs using AI solutions.

AWS Professional Services is a unique consulting team. We pride ourselves on being customer obsessed and highly focused on the AI enablement of our customers. If you have experience with AI, including building ML models, we’d like to have you join our team. You will get to work with an innovative company, with great teammates, and have a lot of fun helping our customers. A successful candidate will be a person who enjoys diving deep into data, doing analysis, discovering root causes, and designing long-term solutions.

This is a customer-facing role and you will be required to travel to client locations and deliver professional services as needed.


Amazon is committed to a diverse and inclusive workplace. Amazon is an equal opportunity employer and does not discriminate on the basis of race, national origin, gender, gender identity, sexual orientation, protected veteran status, disability, age, or other legally protected status. For individuals with disabilities who would like to request an accommodation, please visit https://www.amazon.jobs/en/disability/us.

Pursuant to the San Francisco Fair Chance Ordinance, we will consider for employment qualified applicants with arrest and conviction records.

Pursuant to the Los Angeles Fair Chance Ordinance, we will consider for employment qualified applicants with arrest and conviction records.

For employees based in Colorado, this position starts at $114,700 per year. A sign-on bonus and restricted stock units may be provided as part of the compensation package, in addition to a range of medical, financial, and/or other benefits, dependent on the position offered.",3.8,"Amazon Web Services, Inc.","East Palo Alto, CA",-1,10000+ Employees,1994,Company - Public,Internet,Information Technology,$10+ billion (USD),-1,0,64,118,91.0, CA,26,1,0,0,1
Quantitative Modeler / Data Scientist,64 - 118 ,"As a Quantitative Modeler/data scientist you will conceptualize, develop and execute statistical, mathematical and econometric models for business decision making, risk assessment and strategic initiatives. Quantitative modeling team at the Umpqua bank provides quantitative solutions to business units across the bank. As an important member of the team, you will learn different models and modeling techniques that are used at the bank including but not limited to: financial planning models, fraud detection models, customer analytics, credit risk management, anti-money laundering and asset liability management. This position will also assist in addressing model validation requirements including remediation of validation findings.
This position will report to the Quantitative Modeling Manager. Ideal candidate will forge a strong partnership with business units across the bank and work with them to understand their business requirements and suggest analytical solutions as well as assist in remediating model findings as per MRM guidelines.
Functions",3.6,Umpqua Bank,"East Portland, OR",-1,1001 to 5000 Employees,1953,Company - Public,Banks & Credit Unions,Finance,$1 to $2 billion (USD),-1,0,64,118,91.0, OR,67,0,0,0,0
"Data Scientist, Momentum",64 - 118 ,"WHY YOU’LL LOVE THIS JOB
We believe that what a brand does is more important than what it says—we want you to help brands do amazing, unprecedented, wild things, creating experiences that people never forget.

WHY YOU’LL LOVE DOING IT AT MOMENTUM
Because the idea that a brand’s action is more important than its rhetoric is the key to our entire approach. It is all about the experience and we can—hands down, bar- none—create that better than anyone else. That’s not jargon or ego—it’s truth.
Experience creates the connections that lead to loyalty, advocacy and sales. So we imagine and create those things here, in what we call the total brand experience. And how we do it is with genius, dedication, strategic thinking and working together as one fearless, handsome troop. Before you get any ideas, it’s important you know we’re serious about taking care of each other here. So think on that. We work too closely not to have fun together. We work too smart not to make the world better. And we work too well not to continually push for more. Think on all that, too.





Required Skills

Required Experience",2.5,Momentum,"New York, NY",-1,1 to 50 Employees,-1,Company - Private,-1,-1,Less than $1 million (USD),-1,0,64,118,91.0, NY,-1,0,0,0,0
"AI/ML - Sr Data Scientist, Siri Data",64 - 118 ,"Summary
Posted: Feb 18, 2021
Weekly Hours: 40
Role Number:200223706
Do you get excited by driving product impact via measurement and evaluation, for products and services used by hundreds of millions of people globally? The vision for the Siri Data organization is to improve Siri by using data as the voice of our customers. Within this organization the mission of the Search Analytics team is to inform product evolution through measurement, evaluation, and analysis of the user experience. You will partner with Search engineering teams to improve search quality and guide feature development with data, to deliver amazing search experiences across iPhone, iPad, HomePod, Mac, Watch, tv, across dozens of languages.
Key Qualifications",4.3,Apple,"Seattle, WA",-1,10000+ Employees,1976,Company - Public,Computer Hardware & Software,Information Technology,$10+ billion (USD),-1,0,64,118,91.0, WA,44,0,0,0,0
Research Data Scientist,64 - 118 ,"The Center for Data Science at RTI International, one of the nation’s largest independent, nonprofit scientific research organizations, is seeking a Research Data Scientist with skills in advanced analytics (predictive modeling, machine learning, AI, microsimulation modeling, social network analysis, computer vision, text analytics, and natural language processing), modern software development for data science applications, and data visualization to work on projects in a variety of research domains, including public health, bioinformatics, criminal and social justice, public safety, survey science, engineering, education, and the environment. RTI’s mission is to improve the human condition, and our Center’s mission is to apply data science for social good. A successful candidate will work with a thriving team of 25+ data scientists, software developers, visual designers, and subject matter experts across RTI, solving important national problems, improving our local communities, and transforming research.

Responsibilities
Collaborate with a team of data scientists, software developers, visual designers, and subject matter experts to solve end-to-end problems using data science approaches, techniques, and methods",4.3,RTI International,"Durham, NC",-1,1001 to 5000 Employees,1958,Nonprofit Organization,Research & Development,Business Services,$500 million to $1 billion (USD),-1,0,64,118,91.0, NC,62,0,0,0,0
Data Scientist,64 - 118 ,"Job Description

Here at Intel we create world changing technology that enriches the lives of every person on earth. We are inspired to drive innovation that makes the world safer, builds healthy and vibrant communities and reaches around the globe to better society business and the planet. Our engineers are passionate about finding meaningful solutions for our customers greatest challenges and are united in our purpose to deliver on bold goals. The Data Platforms Group is looking for a passionate data scientist to join our Deep Learning Platform Validation Data Science team.
In this role you will:
Work on challenging projects that vary from data analysis and machine learning to automation and platform design",4.2,Intel,"Hillsboro, OR",-1,10000+ Employees,1968,Company - Public,Computer Hardware & Software,Information Technology,$10+ billion (USD),-1,0,64,118,91.0, OR,52,0,0,0,0
Data Scientist (Optimization Team),115 ,"Company Description
Epsilon is the leader in outcome-based marketing. We enable marketing that’s built on proof, not promises. Through Epsilon PeopleCloud, the marketing platform for personalizing consumer journeys with performance transparency, Epsilon helps marketers anticipate, activate and prove measurable business outcomes. Powered by CORE ID®, the most accurate and stable identity management platform representing 200+ million people, Epsilon’s award-winning data and technology is rooted in privacy by design and underpinned by powerful AI. With more than 50 years of experience in personalization and performance working with the world’s top brands, agencies and publishers, Epsilon is a trusted partner leading CRM, digital media, loyalty and email programs. Positioned at the core of Publicis Groupe, Epsilon is a global company with over 8,000 employees in over 40 offices around the world. For more information, visit epsilon.com. Follow us on Twitter at @EpsilonMktg.
Job Description",3.6,Epsilon,"Chicago, IL",-1,5001 to 10000 Employees,1969,Subsidiary or Business Segment,Advertising & Marketing,Business Services,$2 to $5 billion (USD),-1,0,115,0,57.5, IL,51,0,0,0,0
"Associate, Data Scientist, Optimization",115 ,"Innovate. Collaborate. Build. Create. Solve. The KPMG Digital Lighthouse is KPMG's award-winning Analytics & AI Center of Excellence recognized by clients and leading analyst firms in the US and globally. The KPMG Lighthouse is a curation of specialized technical capabilities and domain experts working across the digital landscape: applied data science, AI, data engineering and insights, software engineering, automation, and big data. Here, you'll work with a diverse team of professionals to explore and build solutions for clients in a multiplatform environment.
You'll be an important part of our high-energy, unique, fast-paced, and innovative culture that delivers with the agility of a tech startup and the backing of a leading global consulting firm. In this particular role, you'll work specifically in the AI Analytics & Engineering Community within the Digital Lighthouse, on a wide range of projects. From applied AI to optimization to big data platform engineering, your analytical and technical skills will drive real impact in the business world. At KPMG, our commitment to your career development helps to set us apart as an employer. We want to enhance your potential, both for yourself and as a contributor to our firm. That's why we provide every opportunity to expand your skills, knowledge and experiences through formal education and training programs, leadership development opportunities, and, as well as informal one-on-one coaching and mentoring from your KPMG colleagues.",3.9,KPMG,"Chicago, IL",-1,10000+ Employees,1987,Company - Private,Consulting,Business Services,$1 to $2 billion (USD),-1,0,115,0,57.5, IL,33,0,0,1,0
Quantitative Modeler / Data Scientist,115 ,"As a Quantitative Modeler/data scientist you will conceptualize, develop and execute statistical, mathematical and econometric models for business decision making, risk assessment and strategic initiatives. Quantitative modeling team at the Umpqua bank provides quantitative solutions to business units across the bank. As an important member of the team, you will learn different models and modeling techniques that are used at the bank including but not limited to: financial planning models, fraud detection models, customer analytics, credit risk management, anti-money laundering and asset liability management. This position will also assist in addressing model validation requirements including remediation of validation findings.
This position will report to the Quantitative Modeling Manager. Ideal candidate will forge a strong partnership with business units across the bank and work with them to understand their business requirements and suggest analytical solutions as well as assist in remediating model findings as per MRM guidelines.
Functions",3.6,Umpqua Bank,"East Portland, OR",-1,1001 to 5000 Employees,1953,Company - Public,Banks & Credit Unions,Finance,$1 to $2 billion (USD),-1,0,115,0,57.5, OR,67,0,0,0,0
"AI/ML - Data Scientist, Siri Data",115 ,"Summary
Posted: Feb 9, 2021
Weekly Hours: 40
Role Number:200221749
Do you get excited by driving product impact via measurement and evaluation, for products and services used by hundreds of millions of people globally? The vision for the Siri Data organization is to improve Siri by using data as the voice of our customers. Within this organization the mission of the Search Analytics team is to inform product evolution through measurement, evaluation, and analysis of the user experience. You will partner with Search engineering teams to improve search quality and guide feature development with data, to deliver amazing search experiences across iPhone, iPad, HomePod, Mac, Watch, tv, across dozens of languages.
Key Qualifications",4.3,Apple,"Seattle, WA",-1,10000+ Employees,1976,Company - Public,Computer Hardware & Software,Information Technology,$10+ billion (USD),-1,0,115,0,57.5, WA,44,0,0,0,0
Data Scientist - Nationwide Opportunities,115 ,"Bachelor’s degree in a highly quantitative field (Computer Science, Machine Learning, Operational Research, Statistics, Mathematics, etc.) or equivalent professional or military experience
Experience with ML fields, e.g., natural language processing, computer vision, statistical learning theory
4+ years of industry experience in predictive modeling, data science, and analysis
Experience in an ML engineer or data scientist role building and deploying ML models or hands on experience developing deep learning models
Experience writing code in Python, R, Scala, Java, C++ with documentation for reproducibility
Experience handling terabyte size datasets, diving into data to discover hidden patterns, using data visualization tools, writing SQL, and working with GPUs to develop models
Experience writing and speaking about technical concepts to business, technical, and lay audiences and giving data-driven presentations
Want to help the largest global enterprises derive business value through the adoption of Artificial Intelligence (AI) and Machine Learning (ML)? Excited by using massive amounts of disparate data to develop ML models? Eager to learn to apply ML to a diverse array of enterprise use cases? Thrilled to be a part of Amazon who has been pioneering and shaping the world’s AI/ML technology for decades?

At Amazon Web Services (AWS), we are helping large enterprises build ML models on the AWS Cloud. We are applying predictive technology to large volumes of data and against a wide spectrum of problems. AWS Professional Services works together with AWS customers to address their business needs using AI solutions.

AWS Professional Services is a unique consulting team. We pride ourselves on being customer obsessed and highly focused on the AI enablement of our customers. If you have experience with AI, including building ML models, we’d like to have you join our team. You will get to work with an innovative company, with great teammates, and have a lot of fun helping our customers. A successful candidate will be a person who enjoys diving deep into data, doing analysis, discovering root causes, and designing long-term solutions.

This is a customer-facing role and you will be required to travel to client locations and deliver professional services as needed.


Amazon is committed to a diverse and inclusive workplace. Amazon is an equal opportunity employer and does not discriminate on the basis of race, national origin, gender, gender identity, sexual orientation, protected veteran status, disability, age, or other legally protected status. For individuals with disabilities who would like to request an accommodation, please visit https://www.amazon.jobs/en/disability/us.

Pursuant to the San Francisco Fair Chance Ordinance, we will consider for employment qualified applicants with arrest and conviction records.

Pursuant to the Los Angeles Fair Chance Ordinance, we will consider for employment qualified applicants with arrest and conviction records.

For employees based in Colorado, this position starts at $114,700 per year. A sign-on bonus and restricted stock units may be provided as part of the compensation package, in addition to a range of medical, financial, and/or other benefits, dependent on the position offered.",3.8,"Amazon Web Services, Inc.","San Francisco, CA",-1,10000+ Employees,1994,Company - Public,Internet,Information Technology,$10+ billion (USD),-1,0,115,0,57.5, CA,26,1,0,0,1
"AI/ML - Sr Data Scientist, Siri Data",115 ,"Summary
Posted: Feb 18, 2021
Weekly Hours: 40
Role Number:200223706
Do you get excited by driving product impact via measurement and evaluation, for products and services used by hundreds of millions of people globally? The vision for the Siri Data organization is to improve Siri by using data as the voice of our customers. Within this organization the mission of the Search Analytics team is to inform product evolution through measurement, evaluation, and analysis of the user experience. You will partner with Search engineering teams to improve search quality and guide feature development with data, to deliver amazing search experiences across iPhone, iPad, HomePod, Mac, Watch, tv, across dozens of languages.
Key Qualifications",4.3,Apple,"Seattle, WA",-1,10000+ Employees,1976,Company - Public,Computer Hardware & Software,Information Technology,$10+ billion (USD),-1,0,115,0,57.5, WA,44,0,0,0,0
"Data Scientist, Data Intelligence",115 ,"To get the best candidate experience, please consider applying for a maximum of 3 roles within 12 months to ensure you are not duplicating efforts.
Job Category
Products and Technology
Job Details
Department Overview: Data Science Apps (DSA)
The Data Science Apps (DSA) team, which sits within the broader Data Intelligence organisation, is a family of multi-talented technologists with backgrounds ranging from Artificial Intelligence to Finance. What connects us all is a shared curiosity for how to drive product strategy with data, a passion for getting the job done, and a healthy disregard for constraints.
Pursuant to the San Francisco Fair Chance Ordinance and the Los Angeles Fair Chance Initiative for Hiring, Salesforce will consider for employment qualified applicants with arrest and conviction records.",4.5,Salesforce,"San Francisco, CA",-1,10000+ Employees,1999,Company - Public,Computer Hardware & Software,Information Technology,$10+ billion (USD),-1,0,115,0,57.5, CA,21,0,0,0,0
Data Scientist,115 ,"Tradeweb is looking to add a Data Scientist to its Data & Analytics team. Our Data Science team is responsible for managing the development and optimization of advanced analytics on a global scale across the company.
In this role, you will enjoy working with one of the richest financial data sets in the world, cutting edge technology, and the ability to see your insights turned into real products on a regular basis. The ideal candidate will have experience doing advanced data analysis, will have worked with large data stores, and will have experience building machine learning models. Candidates should be curious, focused on results, a self-starter, and have demonstrated success in using analytics to drive value in an organization.
Design, build, test and deliver new data science services and advanced analytics to Tradeweb globally
Develop scalable tools leveraging machine learning and/or deep learning models to solve real-world problems in areas such as time series predictions
Suggest, collect and synthesize requirements to create an effective roadmap towards the deployment of production-level machine learning applications",4.5,Tradeweb Markets LLC,"Jersey City, NJ",-1,501 to 1000 Employees,1997,Company - Public,Financial Transaction Processing,Finance,Unknown / Non-Applicable,-1,0,115,0,57.5, NJ,23,0,0,0,0
Energy Data Scientist,115 ,"The Challenge:
Are you excited at the prospect of unlocking the secrets held by data and enabling the visualization of new insights? Are you fascinated by the possibilities presented by the IoT, machine learning, and artificial intelligence advances? Do you have an interest or background in developing cutting-edge energy, resilience, and critical infrastructure solutions? In an increasingly connected world, massive amounts of structured and unstructured data open up new opportunities.
As a data scientist, you can turn these complex data sets into useful information to solve global challenges related to power, fuels, water, and critical infrastructure. We have an opportunity for you to use your analytical skills to improve our business. You’ll work closely with your customer to understand their questions and needs, then dig into their data-rich environment to find the pieces of their information puzzle. You’ll apply analytical skills and use the right combination of tools and frameworks to turn that set of disparate data points into objective answers to help clients make informed decisions. You’ll provide your customer with a deep understanding of their data, what it all means, and how they can use it. Join us as we use data science for good in consulting.
#LI-AH1, APC1, ID13-G",4.2,Booz Allen Hamilton,"Arlington, VA",-1,10000+ Employees,1914,Company - Public,Consulting,Business Services,$5 to $10 billion (USD),-1,0,115,0,57.5, VA,106,0,0,0,0
Data Scientist - Remote,115 ,"At Acxiom, our vision is to transform data into value for everyone. Our data products and analytical services enable marketers to recognize, better understand and then deliver highly applicable messages to consumers across any available channel. Acxiom's products enable true people-based marketing with identity resolution and rich descriptive and predictive audience segmentation. We are seeking an experienced Data Scientist with a versatile skill set to undertake data science supporting the development of next-generation products for Acxiom’s business.

As part of the Analytic Center of Excellence, the Data Scientist will work hands-on with Data Engineering & Pipelining, Machine Learning pipelines, and Cloud Technologies. The Data Scientist will build a scalable data pipeline & machine learning applications and solutions for our domestic and global businesses. The Data Scientist’s responsibilities include collaborating with internal and external stakeholders to identify appropriate data engineering solutions, solution requirements to maximize decision science efficacy. The Data Scientist will be a champion of technology-enabled repeatable process development leveraging the latest and greatest cloud platform tools for ML/AI technologies.



This role can be home-based in the US.
Homebased - Conway, Arkansas",3.7,Acxiom,Remote,-1,1001 to 5000 Employees,1969,Subsidiary or Business Segment,IT Services,Information Technology,$1 to $2 billion (USD),-1,0,115,0,57.5,-1,51,0,0,1,0
Data Scientist,115 ,"LOCATION 4287 Route 130 S Edgewater Park NJ US 08010
Overview
The Data Scientist I will support business areas including Merchandising, Allocations, Marketing, IT and Supply Chain Analytics teams with insights gained from analyzing Burlington and external data. This associate will utilize theirexperience using a variety of data mining/data analysis methods, using a variety of data tools building and implementing models, using/creating algorithms and creating/running simulations.
Burlington is committed to being an employer of choice. We offer a competitive wage and benefit package including a generous paid time off plan, a company matched 401(k) and an associate discount. Our associates make a difference in the lives of customers, colleagues, and our communities through various social responsibility initiatives. As a growing company, we offer a variety of professional development and career growth opportunities.",3.3,Burlington Stores,"Edgewater Park, NJ",-1,10000+ Employees,1972,Company - Public,"Department, Clothing, & Shoe Stores",Retail,$5 to $10 billion (USD),-1,0,115,0,57.5, NJ,48,0,0,0,0
