Job_Title,Salary_Estimate,Job_Description,Rating,Company_Name,Location,Headquarters,Size,Founded,Type_Of_Ownership,Industry,Sector,Revenue,Competitors,Hourly,min_salary,max_salary,average_salary,job_state,age_of_company,python_jd,spark_jd,excel,aws
Data Scientist,115 ,"Accelerate Your Career
Drive global technology

With more than $2 billion in revenues, CDK Global is a leading global provider of integrated information technology and digital marketing solutions to the automotive retail and adjacent industries. Focused on enabling end-to-end automotive commerce, CDK provides solutions to dealers in more than 100 countries around the world, serving approximately 28,000 retail locations and most automotive manufacturers. CDK Global solutions automate and integrate critical processes from pre-sale targeted advertising to the sale, financing, insurance, parts supply, repair and maintenance of vehicles, with an increasing focus on utilizing data analytics and predictive intelligence.

We’re large enough to make a difference but small enough for your voice to be heard. This means that we are an organization where every person matters. You can make an impact on the success of our business and that of our customers regardless of what career you decide to pursue.",3.5,CDK Global,"Hoffman Estates, IL",-1,5001 to 10000 Employees,2014,Company - Public,Computer Hardware & Software,Information Technology,$2 to $5 billion (USD),-1,0,115,0,57.5, IL,6,0,0,0,0
Data Scientist,115 ,"Grainger is a global leading broad line supplier of facilities maintenance products serving businesses and institutions. Our 18,000 employees are driven to serve customers and the community in exceptional ways focusing on delivering the highest level of service. The Grainger team works closely with customers to better understand their challenges and provide cost-saving solutions. Grainger's employees serve customers more than 115,000 times every day through multiple channels. As part of a high-performing team, you’ll be able to develop your talents, and make a difference. Grainger is a Fortune 500 company and a perennial member of Fortune magazine's Most Admired Companies list.

This role typically is located in either our downtown Chicago office or our Lake Forest headquarters, but due to COVID-19 will be fully virtual until further notice. Once these office locations have a return to work plan, the team member will be required to be on-site.",3.9,Grainger,"Chicago, IL",-1,10000+ Employees,1927,Company - Public,Wholesale,Business Services,$10+ billion (USD),-1,0,115,0,57.5, IL,93,0,0,0,0
Research Data Scientist,115 ,"The Infrastructure Quantitative Engineering group is responsible for the strategic analysis to support and enable the continued growth critical to Facebook’s infrastructure organization. We are applied quantitative and computational experts using math, statistics and machine learning to measure & optimize cost, performance, reliability and efficiency of Facebook’s infrastructure & global telecom systems to deliver the best experience to our global audience. The ideal candidate will be passionate about Facebook, have strong analytical and modeling aptitude and has experience using data to drive cost effective decision making.
Build pragmatic, scalable, and statistically rigorous solutions to large-scale web, mobile and data infrastructure problems by leveraging or developing state-of-the-art statistical and machine learning methodologies on top of Facebook's unparalleled data infrastructure
Work cross-functionally to define problem statements, collect data, build analytical models and make recommendations
Build and maintain data driven optimization models, experiments, forecasting algorithms, and machine learning models
#LI-REMOTE",4.4,Facebook,"Menlo Park, CA",-1,10000+ Employees,2004,Company - Public,Internet,Information Technology,$5 to $10 billion (USD),-1,0,115,0,57.5, CA,16,0,0,0,0
"Product Data Scientist, Discover",115 ,"Snap Inc. is a camera company. We believe that reinventing the camera represents our greatest opportunity to improve the way people live and communicate. Our products empower people to express themselves, live in the moment, learn about the world, and have fun together.
Snapchat is the camera used by millions of people every day to Snap with family, watch Stories from friends, see events from around the world, and explore expertly curated content from top publishers. In short, we are a passionate team working hard to build the best platform in the world for communication and storytelling.
We are looking for a Data Scientist to join our Product team at Snap Inc! Working from our San Francisco office, you will use data to help the team understand what is working, what to improve and what gaps we have. Partnering with Product, Design and Engineering, you will be a core member in driving our overall roadmap and long-term strategy
What you’ll do:",4.0,Snapchat,"San Francisco, CA",-1,1001 to 5000 Employees,2011,Company - Public,Computer Hardware & Software,Information Technology,Unknown / Non-Applicable,-1,0,115,0,57.5, CA,9,0,0,0,0
Data Scientist-Junior,115 ,"Business Group Highlights


Defense
The Defense group supports the Department of Defense (DoD) mission to keep our homeland and its citizens safe. We provide solutions to improve the Nation's defense by providing software, systems engineering, IT, training and logistics and fleet management solutions.


Responsibilities

This position is for a large contract for the Army, providing leadership and support existing systems, processes, and policies as well as working to implement new technologies and processes in support of the client’s mission to provide Intelligence training and technologies to military personnel.",3.6,Perspecta,"Washington, DC",-1,10000+ Employees,2018,Company - Public,Aerospace & Defense,Aerospace & Defense,Unknown / Non-Applicable,-1,0,115,0,57.5, DC,2,0,0,0,0
Data Scientist,115 ,"About City of Hope
City of Hope, an innovative biomedical research, treatment and educational institution with over 6000 employees, is dedicated to the prevention and cure of cancer and other life-threatening diseases and guided by a compassionate, patient-centered philosophy.

Founded in 1913 and headquartered in Duarte, California, City of Hope is a remarkable non-profit institution, where compassion and advanced care go hand-in-hand with excellence in clinical and scientific research. City of Hope is a National Cancer Institute designated Comprehensive Cancer Center and a founding member of the National Comprehensive Cancer Network, an alliance of the nation’s leading cancer centers that develops and institutes standards of care for cancer treatment.

Position Summary
The Data Scientist in this role will query and analyze large complex datasets to discover insights to apply to an evolving cancer care delivery environment. The Data Scientist will use data mining, statistics and machine learning to understand relationships and patterns in data, build predictive models and propose actionable solutions.










City of Hope is committed to creating a diverse environment and is proud to be an equal opportunity employer. All qualified applicants will receive consideration for employment without regard to race, religion, color, national origin, sex, sexual orientation, gender identity, age, status as a protected veteran, or status as a qualified individual with disability.",3.5,City of Hope,"Duarte, CA",-1,5001 to 10000 Employees,1913,Nonprofit Organization,Health Care Services & Hospitals,Health Care,$100 to $500 million (USD),-1,0,115,0,57.5, CA,107,0,0,1,0
Sr Data Scientist,115 ,"Job Summary:
Cloud Platform Engineering creates software solutions in the cloud and for Disney teams to operate in the cloud. We enable them to do more in the cloud securely, and in less time. You will be the first Data Scientist to join this team! We do so by providing:
cloud account provisioning and automation
centralized cloud logging, operational and best practices insights
cloud cost related analytics and avoidance recommendations

Responsibilities:",4.1,The Walt Disney Company (Corporate),"Seattle, WA",-1,10000+ Employees,1923,Company - Public,Motion Picture Production & Distribution,Media,$10+ billion (USD),-1,0,115,0,57.5, WA,97,0,0,0,0
Research Data Scientist,115 ,"IAI is looking for a talented research scientist to contribute to research and development efforts in machine learning, graph theory, and scientific software development. The candidate will incorporate novel ideas and improve the state of the art on advanced projects related to processing of large networks, analyzing data in high dimensions and implementing high performance computing software. Additionally, the candidate will develop a portfolio of related research by extending existing work and proposing new methods with novel application domains.

You are highly encouraged to apply if you enjoy working with data and algorithms, passionate about understanding how things work, want to solve complex problems and strive to stay current on the technology and literature in areas of high performance computing, network analysis and machine learning.",3.7,Intelligent Automation,"Rockville, MD",-1,51 to 200 Employees,1987,Company - Private,"Health, Beauty, & Fitness",Consumer Services,$25 to $50 million (USD),-1,0,115,0,57.5, MD,33,0,0,0,0
Sr Data Scientist,115 ,"Leads and participates in the development, validation and delivery of algorithms, statistical models and reporting tools. Solves complex analytical problems.
Develops and/or uses algorithms and statistical predictive models and determines analytical approaches and modeling techniques to evaluate scenarios and potential future outcomes. Performs analyses of structured and unstructured data to solve multiple and/or complex business problems utilizing advanced statistical techniques and mathematical analyses and broad knowledge of the organization and/or industry. Collaborates with business partners to understand their problems and goals, develop predictive modeling, statistical analysis, data reports and performance metrics. Develops and participates in presentations and consultations to existing and prospective constituents on analytics results and solutions. Interacts with internal and external peers and managers to exchange complex information related to areas of specialization. Use strong knowledge in algorithms and predictive models to investigate problems, detect patterns and recommend solutions. Use strong programming skills to explore, examine and interpret large volumes of data in various forms.

Required Qualifications
Demonstrates strong ability to communicate technical concepts and implications to business partners.
Anticipates and prevents problems and roadblocks before they occur.
Strong knowledge of advanced analytics tools and languages to analyze large data sets from multiple data sources.
Demonstrates proficiency in most areas of mathematical analysis methods, machine learning, statistical analyses, and predictive modeling and in-depth specialization in some areas.


5 or more years of progressively complex related experience.


Bachelor's degree or equivalent work experience in Mathematics, Statistics, Computer Science, Business Analytics, Economics, Physics, Engineering, or related discipline.
Master’s degree or PhD preferred.


At CVS Health, we are joined in a common purpose: helping people on their path to better health. We are working to transform health care through innovations that make quality care more accessible, easier to use, less expensive and patient-focused. Working together and organizing around the individual, we are pioneering a new approach to total health that puts people at the heart.",3.1,CVS Health,"Chicago, IL",-1,10000+ Employees,1963,Company - Public,Health Care Services & Hospitals,Health Care,$10+ billion (USD),-1,0,115,0,57.5, IL,57,0,0,0,0
Senior Data Scientist (Remote-friendly),115 ,"At Noom, we use scientifically proven methods to help our users create healthier lifestyles, and manage important conditions like Type-II Diabetes, Obesity, and Hypertension. Our Engineering team is at the forefront of this challenge, solving complex technical and UX problems on our mobile apps that center around habits, behavior, and lifestyle.
We are looking for a Data Scientist to join our Data team and help us ensure that we apply the best approaches to data analysis and research, artificial intelligence, and machine learning.
What You’ll Like About Us:
We work on problems that affect the lives of real people. Our users depend on us to make positive changes to their health and their lives.
We base our work on scientifically-proven, peer-reviewed methodologies that are designed by medical professionals.",4.3,Noom Inc.,"New York, NY",-1,1001 to 5000 Employees,2008,Company - Private,"Health, Beauty, & Fitness",Consumer Services,Unknown / Non-Applicable,-1,0,115,0,57.5, NY,12,0,0,0,0
Data Scientist,115 ,"Key Accountabilities
The Advanced Analytics - Data Scientist would be a hands-on problem solver with a business oriented, results driven , self-starter mindset . In order to succeed in this role the applicant should be a very strong team player , eager to take on challenges and responsibility of increasing complexity, have impeccable attention to detail , be able to work independently , able to successfully complete analytics projects within time with the business outcome in mind, apply scientific rigor to analyses and models, be able to improvise and solve problems in the absence of perfect data and be able to simplify and communicate complex results to key business stakeholders via presentation and visualization tools.
Ideal candidate will design , develop, and execute key quantitative/modeling projects to drive improvement in retention and acquisition win-rates as well as contribution margin / profitability. Excellent communication and inter-personal skills are vital to success in this role.",3.5,Vistra Corporate Services Company,"Irving, TX",-1,5001 to 10000 Employees,1996,Subsidiary or Business Segment,Utilities,"Oil, Gas, Energy & Utilities",Less than $1 million (USD),-1,0,115,0,57.5, TX,24,0,0,1,0
Sr. Data Scientist,115 ,"Job Summary Responsible for leveraging internal and external data to provide insights and information which supports a facts-based decision making process. Provides input into strategy, analysis methods and tool selection. Acts as a key contributor in a complex and crucial environment. May lead teams or projects and shares expertise.
Job Description

Description:
Freewheel is currently looking to recruit a Sr. Data Scientist to join our Data Science Team. This role will be responsible for supporting product development efforts related to machine learning, optimization methods, and statistical model building. This role will work very closely with engineering and product management staff to support the development of innovative approaches to the next generation of ad tech products. Required Skills:
Implement ad tech solutions leveraging statistical models and machine learning methods
Identify key data questions and conducting exploratory analyses
Building forecasting methods for advertising use cases
Applying optimization methods for ad scheduling applications
Effectively leveraging key functionality in AWS and Spark-based technologies
Researching and applying new technologies and analytical methods.
Applying advanced data visualization to provide key insights
Working independently and as part of a broader team across multiple project

Desired Skills and Experience
Bachelor’s degree in a technical field such as Data Science, Computer Science, Engineering, Business Analytics, Mathematics, Statistics, or Operations Research, Master’s or PhD a plus
At least 3 of experience with Python, SQL, and analytical model implementation
Experience with Optimization Models such as Linear and Nonlinear Programming
Skilled at data mangling and manipulation
Experience with data visualization tools and programming packages
Strong analytical and problem-solving skills; ability to work creatively in problem solving environment
Experience using AWS or other cloud-based platforms
Proven ability to deliver on complex projects within deadlines
Ability to communicate technical concepts to a non-technical audience
Strong interest in advertising technology


Understand our Operating Principles; make them the guidelines for how you do your job.
Own the customer experience - think and act in ways that put our customers first, give them seamless digital options at every touchpoint, and make them promoters of our products and services.
Know your stuff - be enthusiastic learners, users and advocates of our game-changing technology, products and services, especially our digital tools and experiences.
Win as a team - make big things happen by working together and being open to new ideas.
Be an active part of the Net Promoter System - a way of working that brings more employee and customer feedback into the company - by joining huddles, making call backs and helping us elevate opportunities to do better for our customers.
Drive results and growth.
Respect and promote inclusion & diversity.
Do what's right for each other, our customers, investors and our communities.


This information has been designed to indicate the general nature and level of work performed by employees in this role. It is not designed to contain or be interpreted as a comprehensive inventory of all duties, responsibilities and qualifications.

Comcast is an EOE/Veterans/Disabled/LGBT employer.

Education
Master's Degree
Relevant Work Experience
7-10 Years
Base pay is one part of the Total Rewards that Comcast provides to compensate and recognize employees for their work. Most sales positions are eligible for a Commission under the terms of an applicable plan, while most non-sales positions are eligible for a Bonus. Additionally, Comcast provides best-in-class Benefits. We believe that benefits should connect you to the support you need when it matters most, and should help you care for those who matter most. That’s why we provide an array of options, expert guidance and always-on tools, that are personalized to meet the needs of your reality – to help support you physically, financially and emotionally through the big milestones and in your everyday life. Please visit the compensation and benefits summary on our careers site for more details.",3.9,Comcast,"New York, NY",-1,10000+ Employees,1963,Company - Public,Telecommunications Services,Telecommunications,$10+ billion (USD),-1,0,115,0,57.5, NY,57,1,1,0,1
Data Scientist,115 ,"DESCRIPTION:
Duties: Model datasets to predict activity within core markets, both global consumer financial activity and financial markets focusing on the Chinese market. Perform statistical modeling of quantitative/timeseries data and build AI Natural Language Processing models. Program implementation of the models and design and implementation of UI tools to allow the models to be used by non-data-scientist employees. Research and develop new AI techniques for analysis of alternative data. Advise portfolio managers on the incorporation of machine-learning into the investment processes.

QUALIFICATIONS:
Minimum education and experience required: This position requires a Master's degree in Mathematics, Statistics, Computer Science, or related field of study and three (3) years of experience in the job offered or three (3) years of experience as a Risk Manager, Algorithm Engineer, or related occupation. The employer will accept a PhD and one (1) year of experience in lieu of a Master's degree and three (3) years of experience.

This position requires one (1) year of experience with the following skills and technologies: data science and statistical modelling focusing on consumer finance data; machine learning and AI models for natural language processing; creating technology solutions using data, machine learning and AI to solve finance problems; Python quantitative libraries including numpy and pandas; R; C++; SQL; Matlab; deep learning libraries including tensorflow and scikit-learn; ElasticSearch; models including CNN/RNN and LSTM; and UI design tools and frameworks, including Angular JS or React.JPMorgan Chase & Co., one of the oldest financial institutions, offers innovative financial solutions to millions of consumers, small businesses and many of the world's most prominent corporate, institutional and government clients under the J.P. Morgan and Chase brands. Our history spans over 200 years and today we are a leader in investment banking, consumer and small business banking, commercial banking, financial transaction processing and asset management.

We recognize that our people are our strength and the diverse talents they bring to our global workforce are directly linked to our success. We are an equal opportunity employer and place a high value on diversity and inclusion at our company. We do not discriminate on the basis of any protected attribute, including race, religion, color, national origin, gender, sexual orientation, gender identity, gender expression, age, marital or veteran status, pregnancy or disability, or any other basis protected under applicable law. In accordance with applicable law, we make reasonable accommodations for applicants' and employees' religious practices and beliefs, as well as any mental health or physical disability needs.

Equal Opportunity Employer/Disability/Veterans",3.8,"JPMorgan Chase Bank, N.A.","New York, NY",-1,10000+ Employees,1799,Subsidiary or Business Segment,Banks & Credit Unions,Finance,$10+ billion (USD),-1,0,115,0,57.5, NY,221,1,0,0,0
"Data Scientist Trainee, Chubb Associate Program",115 ,"Data Scientist Trainee, Chubb Associate Program(Job Number: 336290)
Description

This position will be responsible for building, testing, validating and maintaining predictive models for pricing and underwriting functions within the Commercial Lines Analytics team. The position will contribute to innovative approaches to model development while building knowledge of the business context in which the models operate. Other responsibilities will include implementing and monitoring the usage of the models. The person will be expected to understand and analyze complex insurance risk factors and articulate results to the various stakeholders, including but not limited to underwriters, product managers and actuaries.
Qualifications
BS degree or higher in Data Science; Actuarial Science; Mathematics; Economics; Finance",3.6,Chubb,United States,-1,10000+ Employees,1792,Company - Public,Insurance Carriers,Insurance,$10+ billion (USD),-1,0,115,0,57.5,-1,228,0,0,0,0
Data Scientist / Bioinformatician,115 ,"Title: Data Scientist / Bioinformatician



Location: Remote



About Akoya Biosciences, Inc.
Akoya Biosciences, Inc., The Spatial Biology Company™, is a fast-growing company that is developing
powerful staining and imaging tools that enable scientists and clinicians to gain a better understanding of
complex diseases such as cancer, immune disorders and neurodegenerative disease. Our CODEX®
platform can image more than 40 protein targets in a single sample and is ideal for biomarker discovery.
Our Phenoptics platform, the industry standard for multiplex immunofluorescence and
immunohistochemistry, provides the assay robustness and throughput necessary for translational
research studies on large sample numbers. Adoption of our technology by leading academic medical
centers and pharmaceutical companies will ensure healthy growth for years to come.



The Data Scientist / Bioinformatician will participate in development and testing of new
analytical pipelines for multiplex imaging data.










Machine Learning, Statistics or Applied Mathematics.",3.8,Akoya Biosciences,Remote,-1,51 to 200 Employees,-1,Company - Private,Biotech & Pharmaceuticals,Biotech & Pharmaceuticals,Less than $1 million (USD),-1,0,115,0,57.5,-1,-1,0,0,0,0
Data Scientist - Research & Economics,115 ,"Our policy data scientists support our policy issue experts around the world by conducting rigorous and objective research. The Economics team produces in-house research and collaborates with world-leading academics to understand our marketplace and improve our products.
About the Role
We are looking for an economics-minded data scientist to drive top cross-functional priorities for the company. In this role, you would be part of the Policy, Research and Economics team, which is led by the Chief Economist. Our team conducts research and analysis that forms the foundation for business decisions and our policy positions.
As a data scientist on this team, you would be encouraged to bring analytical and empirical rigor to bear on important questions relating to Uber's marketplace. We are seeking individuals with a background in economics or other quantitative social sciences, with an ability to think critically about a research question and design and implement data analysis and data pipelines in SQL/R/Python.",4.0,Uber,"San Francisco, CA",-1,10000+ Employees,2009,Company - Public,Internet,Information Technology,$10+ billion (USD),-1,0,115,0,57.5, CA,11,1,0,0,0
