Job_Title,Salary_Estimate,Job_Description,Rating,Company_Name,Location,Headquarters,Size,Founded,Type_Of_Ownership,Industry,Sector,Revenue,Competitors,Hourly,min_salary,max_salary,average_salary,job_state,age_of_company,python_jd,spark_jd,excel,aws
Data Scientist,120 - 180 ,"Company Overview:
At Memorial Sloan Kettering (MSK), we’re not only changing the way we treat cancer, but also the way the world thinks about it. By working together and pushing forward with innovation and discovery, we’re driving excellence and improving outcomes. We’re treating cancer, one patient at a time. Join us and make a difference every day.
Job Description:
As part of MSK's new and exciting digital transformation, we are hiring enthusiastic data scientist team members to build and deliver a one-of-a-kind data facility. You'll have the chance to work with clinicians and researchers to achieve the goal of translating institutional information into meaningful insights in order to improve patient care, hospital operations, and clinical research.
About us – Unified Data Fabric
We are developing one of the most robust oncology data ecosystems in all of healthcare, the Unified Data Fabric. The integration of clinical, genomic, operational, and financial data will lead to countless insights, through the integration of high quality, authoritative, discrete, unstructured, streaming, and imaging data, by way of creating a unique and unprecedented healthcare data platform. This data platform will be a combination of cloud and on-prem technologies and will be built on state-of-the-art architecture that includes APIs, object stores, data streaming, image processing, DBMS pipelines and data warehousing technologies, with a foundation of enterprise data governance and stewardship practices including advanced semantics and machine learning to generate more data of value within the Unified Data Fabric.




Closing:",4.1,Memorial Sloan-Kettering Cancer Center,"New York, NY",-1,10000+ Employees,1884,Nonprofit Organization,Health Care Services & Hospitals,Health Care,$2 to $5 billion (USD),-1,0,120,180,150.0, NY,136,0,0,1,0
Tableau Data Scientist,120 - 180 ,"Responsibilities:
• Develop smart, compelling dashboards and reports to track key performance indicators (KPI’s), identify trends, and monitor company initiatives on business operation results and line of business weekly, monthly, quarterly.
• Build predictive pattern and trends, related to investigation and root cause determination business operations, operational functions, workflow, processes, and other business-related issues.
• Work with the support teams and business technology to build and implement analytics performance metrics, measurements, methods and targets.
• Leverage Business Intelligence Tools Tableau Desktop, Tableau Prep, ServiceNow Performance Analytics, Microsoft Excel as developer.
• Construct dashboards and reports as needed using Tableau Desktop and collaboration using Tableau Server. Create report schedules on Tableau server.
• Report on common sources of technical issues or questions and make recommendations to operational improvements. Communicate key insights and findings to stakeholders.
• Perform unit and performance testing of the reports developed. Help design, document and maintain system processes.

Qualifications
• Bachelor’s degree in computer science or related discipline; or an equivalent combination of education and experience from which comparable knowledge and skills may be acquired.
• 5-7 years of current and hands-on experience with Tableau Desktop and demonstrated expertise with complex data visualizations and data modelling.
• 1 year hands-on experience using Tableau prep and automating prep flows on Tableau Server
• Experience with all features of Tableau version 2020.4 and beyond – Data sources, Extracts, Variety of Data Visualizations, Tableau server Collaboration.
• Demonstrate experience delivering solutions to stringent SLAs for report performance
• Ability to manage priorities and meet critical deadlines.
• Extensive computer software skills with other programs such as Microsoft Excel, PowerPoint, and SharePoint.
• Ability to solve advanced-level, complicated problems with minimal supervision.
• Ability to cleanse, aggregate, merge or otherwise prepare data for analysis using Tableau Prep tool.
• Tableau Desktop certification preferred.

Technical Skills/Proficiency
• Utilize programming and business intelligence skills (SQL, Tableau) on analytical platforms to prepare and manage data; create dashboards; develop KPIs and provide business insights
• Demonstrate extensive knowledge in various reporting objects like facts, attributes, hierarchies, transformations, filters, prompts, calculated fields, sets, groups, parameters etc., in Tableau.
• Understand database structure and processes with strong knowledge of SQL queries and data sets.
• Experience extracting new and innovative insights from sophisticated, non-traditional and/or larger datasets
• Experience with Tableau Desktop and Tableau Prep data extract/output refresh automation on Tableau Server
• Excellent verbal and written communications skills. Ability to communicate effectively with team members and stakeholders and Sr. Management on both
• Strong analytical and problem-solving skills",2.5,Technology Ventures,"McLean, VA",-1,1 to 50 Employees,-1,Company - Private,Staffing & Outsourcing,Business Services,$1 to $5 million (USD),-1,0,120,180,150.0, VA,-1,0,0,1,0
Research Data Scientist,120 - 180 ,"The Center for Data Science at RTI International, one of the nation’s largest independent, nonprofit scientific research organizations, is seeking a Research Data Scientist with skills in advanced analytics (predictive modeling, machine learning, AI, microsimulation modeling, social network analysis, computer vision, text analytics, and natural language processing), modern software development for data science applications, and data visualization to work on projects in a variety of research domains, including public health, bioinformatics, criminal and social justice, public safety, survey science, engineering, education, and the environment. RTI’s mission is to improve the human condition, and our Center’s mission is to apply data science for social good. A successful candidate will work with a thriving team of 25+ data scientists, software developers, visual designers, and subject matter experts across RTI, solving important national problems, improving our local communities, and transforming research.

Responsibilities
Collaborate with a team of data scientists, software developers, visual designers, and subject matter experts to solve end-to-end problems using data science approaches, techniques, and methods",4.3,RTI International,"Durham, NC",-1,1001 to 5000 Employees,1958,Nonprofit Organization,Research & Development,Business Services,$500 million to $1 billion (USD),-1,0,120,180,150.0, NC,62,0,0,0,0
Data Scientist,120 - 180 ,"Great that you're thinking about a career with BSI!
About the role:
The Data Scientist role is a critical new role within the BSI group. This role will partner with the Group Innovation organization, key data owners and AI partners and will identify ways of using data to further our goals of digital assurance and advanced predictive analytics. Position will identify and work closely with external data providers or strategic partners. This position will work closely with data experiments, projects, and solutions builds. This role reports to the Director of AI and Data Science.
Data Scientist Responsibilities:
Work closely with the Director to build AI and Data Science solutions, including productionizing workflows",3.5,BSI,United States,-1,201 to 500 Employees,1843,Company - Private,Wholesale,Business Services,Less than $1 million (USD),-1,0,120,180,150.0,-1,177,0,0,0,0
Data Scientist,120 - 180 ,"Meet Our Team:
The Client Success Strategy and Operations team is a partner to CS leadership and the CS field, tasked to maintain strategic alignment across regions in the execution of enablement and onboarding, knowledge management and communication, strategic transformation and regional operational support.
Picture Yourself at Pega:
You will be part of a thought leading innovative team driving scalability and new insights. Be part of a highly collaborative and energetic team working alongside the Client Success organization driving better insights through Data, Data Quality and AI",4.1,Pegasystems,Alabama,-1,5001 to 10000 Employees,1983,Company - Public,Enterprise Software & Network Solutions,Information Technology,$500 million to $1 billion (USD),-1,0,120,180,150.0,-1,37,0,0,0,0
Data Scientist,120 - 180 ,"Join our team! As a global leader in providing title insurance, settlement services and risk solutions for real estate transactions, First American (NYSE: FAF) is an ideal place to build your career. We have been entrusted with helping our customers achieve and protect their dream of homeownership since 1889. We believe that our people are the key to the company’s continued success, and we invest in diverse talents and backgrounds and empower our teams to achieve more than they could anywhere else. First American has created an award-winning culture and has been named to the Fortune 100 Best Companies to Work For® list for the fifth consecutive year and to more than 50 regional Best Places to Work lists. For more information, please visit www.careers.firstam.com
Job Summary
How would you like to work for one of Fortune’s top 100 Best Places to Work in 2020? At First American, we believe in People First and it shows in the passion and energy of our employees. We are seeking a Data Scientist to join our growing team. The ideal candidate will be intricately involved in performing analysis and developing models to support business decisions and manage risk. This individual will work with a variety of data assets from multiple sources using a variety of techniques, ranging from simple data aggregation via statistical analysis to complex data mining and machine learning tasks. This is a perfect opportunity for the successful candidate to become part of an innovative and energetic team that designs, develops, and implements the most valuable business solutions for the entire organization.",3.7,First American,"Santa Ana, CA",-1,10000+ Employees,1889,Company - Public,Insurance Carriers,Insurance,$5 to $10 billion (USD),-1,0,120,180,150.0, CA,131,0,0,0,0
Data Scientist,120 - 180 ,"Travel Required: None
Public Trust: NACI (T1)
Requisition Type: Regular
Data Analytics/ Scientist
Perform Data Analytics and Machine Learning with FAA data sources using AWS
Develop and Setup Safety Risk Analysis framework and methodology for data access, retrieval, analytics and visualizations of results
Perform data source fusion/ integration with textual and non-textual data
Leverage key AI/ ML technologies like Natural Language Processing, Text Based Analytics, Clustering, Recommender Algorithm, Deep Learning to help determine safety hazards
We are GDIT. The people supporting some of the most complex government, defense, and intelligence projects across the country. We deliver. Bringing the expertise needed to understand and advance critical missions. We transform. Shifting the ways clients invest in, integrate, and innovate technology solutions. We ensure today is safe and tomorrow is smarter. We are there. On the ground, beside our clients, in the lab, and everywhere in between. Offering the technology transformations, strategy, and mission services needed to get the job done.",3.8,General Dynamics Information Technology,"Washington, DC",-1,10000+ Employees,1996,Subsidiary or Business Segment,IT Services,Information Technology,$10+ billion (USD),-1,0,120,180,150.0, DC,24,0,0,0,1
Data Scientist 4,120 - 180 ,"Data Scientist 4-21000E8M

Applicants are required to read, write, and speak the following languages: English
Detailed Description and Job Requirements
Designs, develops and programs methods, processes, and systems to consolidate and analyze unstructured, diverse “big data” sources to generate actionable insights and solutions for client services and product enhancement.

Interacts with product and service teams to identify questions and issues for data analysis and experiments. Develops and codes software programs, algorithms and automated processes to cleanse, integrate and evaluate large datasets from multiple disparate sources. Identifies meaningful insights from large data and metadata sources; interprets and communicates insights and findings from analysis and experiments to product, service, and business managers.

Leading contributor individually and as a team member, providing direction and mentoring to others. Work is non-routine and very complex, involving the application of advanced technical/business skills in area of specialization. 8 years relevant work experience. BS/BA preferred.",3.7,Oracle,United States,-1,10000+ Employees,1977,Company - Public,Enterprise Software & Network Solutions,Information Technology,$10+ billion (USD),-1,0,120,180,150.0,-1,43,0,0,0,0
Data Scientist (Optimization Team),120 - 180 ,"Company Description
Epsilon is the leader in outcome-based marketing. We enable marketing that’s built on proof, not promises. Through Epsilon PeopleCloud, the marketing platform for personalizing consumer journeys with performance transparency, Epsilon helps marketers anticipate, activate and prove measurable business outcomes. Powered by CORE ID®, the most accurate and stable identity management platform representing 200+ million people, Epsilon’s award-winning data and technology is rooted in privacy by design and underpinned by powerful AI. With more than 50 years of experience in personalization and performance working with the world’s top brands, agencies and publishers, Epsilon is a trusted partner leading CRM, digital media, loyalty and email programs. Positioned at the core of Publicis Groupe, Epsilon is a global company with over 8,000 employees in over 40 offices around the world. For more information, visit epsilon.com. Follow us on Twitter at @EpsilonMktg.
Job Description",3.6,Epsilon,"Chicago, IL",-1,5001 to 10000 Employees,1969,Subsidiary or Business Segment,Advertising & Marketing,Business Services,$2 to $5 billion (USD),-1,0,120,180,150.0, IL,51,0,0,0,0
"Data Scientist, Revenue Optimization",64 - 118 ,"Summary: The Data Scientist is responsible for developing and refining models to enable Revenue Management to optimize room revenue. The Data Scientist will discover revenue opportunities, design models and experiments, deploy solutions, iterate, and measure success of those solutions.
Responsibilities:
Create, implement, and iterate predictive and/or prescriptive models to drive revenue through price and conversion across revenue management, CRM, web, onsite revenue, and other critical commercial levers.
Leverage R, Python, or similar to execute analysis in cloud data warehouse (Snowflake) for large-scale analytical efforts. Advanced knowledge of R or Python as well as statistical packages and libraries required.
Build statistical models to understand and capitalize on revenue trends, including but not limited to price elasticity of demand (PEoD)",3.6,Great Wolf Lodge,"Madison, WI",-1,10000+ Employees,1997,Company - Private,"Hotels, Motels, & Resorts",Travel & Tourism,Unknown / Non-Applicable,-1,0,64,118,91.0, WI,23,1,0,0,0
Data Scientist (Optimization Team),64 - 118 ,"Company Description
Epsilon is the leader in outcome-based marketing. We enable marketing that’s built on proof, not promises. Through Epsilon PeopleCloud, the marketing platform for personalizing consumer journeys with performance transparency, Epsilon helps marketers anticipate, activate and prove measurable business outcomes. Powered by CORE ID®, the most accurate and stable identity management platform representing 200+ million people, Epsilon’s award-winning data and technology is rooted in privacy by design and underpinned by powerful AI. With more than 50 years of experience in personalization and performance working with the world’s top brands, agencies and publishers, Epsilon is a trusted partner leading CRM, digital media, loyalty and email programs. Positioned at the core of Publicis Groupe, Epsilon is a global company with over 8,000 employees in over 40 offices around the world. For more information, visit epsilon.com. Follow us on Twitter at @EpsilonMktg.
Job Description",3.6,Epsilon,"Chicago, IL",-1,5001 to 10000 Employees,1969,Subsidiary or Business Segment,Advertising & Marketing,Business Services,$2 to $5 billion (USD),-1,0,64,118,91.0, IL,51,0,0,0,0
AI/ML Health Data Scientist- Consultant,64 - 118 ,"Overview

Guidehouse is a leading management consulting firm serving the public and commercial markets. We guide our clients forward towards new futures that build trust in society and your professional skills along the journey. Join us at Guidehouse.

Responsibilities

Our consultants on the Advanced Analytics & Intelligent Automation team help clients maximize the value of their data and automate business processes. This high performing team works with clients to implement the full spectrum of data analytics and data science, from data querying and data wrangling, to data visualization and dashboarding, to predictive analytics, machine learning, and artificial intelligence as well as robotic process automation (RPA). Our services enable our clients to define their information strategy, enable mission critical insights and data-driven decision making, reduce cost and complexity, increase trust, and improve operational effectiveness.",3.7,Guidehouse,"Washington, DC",-1,5001 to 10000 Employees,2018,Company - Private,Consulting,Business Services,Unknown / Non-Applicable,-1,0,64,118,91.0, DC,2,0,0,0,0
Data Scientist-Junior,64 - 118 ,"Business Group Highlights


Defense
The Defense group supports the Department of Defense (DoD) mission to keep our homeland and its citizens safe. We provide solutions to improve the Nation's defense by providing software, systems engineering, IT, training and logistics and fleet management solutions.


Responsibilities

This position is for a large contract for the Army, providing leadership and support existing systems, processes, and policies as well as working to implement new technologies and processes in support of the client’s mission to provide Intelligence training and technologies to military personnel.",3.6,Perspecta,"Washington, DC",-1,10000+ Employees,2018,Company - Public,Aerospace & Defense,Aerospace & Defense,Unknown / Non-Applicable,-1,0,64,118,91.0, DC,2,0,0,0,0
Data Scientist 4,64 - 118 ,"Data Scientist 4-21000E8M

Applicants are required to read, write, and speak the following languages: English
Detailed Description and Job Requirements
Designs, develops and programs methods, processes, and systems to consolidate and analyze unstructured, diverse “big data” sources to generate actionable insights and solutions for client services and product enhancement.

Interacts with product and service teams to identify questions and issues for data analysis and experiments. Develops and codes software programs, algorithms and automated processes to cleanse, integrate and evaluate large datasets from multiple disparate sources. Identifies meaningful insights from large data and metadata sources; interprets and communicates insights and findings from analysis and experiments to product, service, and business managers.

Leading contributor individually and as a team member, providing direction and mentoring to others. Work is non-routine and very complex, involving the application of advanced technical/business skills in area of specialization. 8 years relevant work experience. BS/BA preferred.",3.7,Oracle,United States,-1,10000+ Employees,1977,Company - Public,Enterprise Software & Network Solutions,Information Technology,$10+ billion (USD),-1,0,64,118,91.0,-1,43,0,0,0,0
Data Scientist,64 - 118 ,"Tradeweb is looking to add a Data Scientist to its Data & Analytics team. Our Data Science team is responsible for managing the development and optimization of advanced analytics on a global scale across the company.
In this role, you will enjoy working with one of the richest financial data sets in the world, cutting edge technology, and the ability to see your insights turned into real products on a regular basis. The ideal candidate will have experience doing advanced data analysis, will have worked with large data stores, and will have experience building machine learning models. Candidates should be curious, focused on results, a self-starter, and have demonstrated success in using analytics to drive value in an organization.
Design, build, test and deliver new data science services and advanced analytics to Tradeweb globally
Develop scalable tools leveraging machine learning and/or deep learning models to solve real-world problems in areas such as time series predictions
Suggest, collect and synthesize requirements to create an effective roadmap towards the deployment of production-level machine learning applications",4.5,Tradeweb Markets LLC,"Jersey City, NJ",-1,501 to 1000 Employees,1997,Company - Public,Financial Transaction Processing,Finance,Unknown / Non-Applicable,-1,0,64,118,91.0, NJ,23,0,0,0,0
Data Scientist,64 - 118 ,"Company Overview:
At Memorial Sloan Kettering (MSK), we’re not only changing the way we treat cancer, but also the way the world thinks about it. By working together and pushing forward with innovation and discovery, we’re driving excellence and improving outcomes. We’re treating cancer, one patient at a time. Join us and make a difference every day.
Job Description:
As part of MSK's new and exciting digital transformation, we are hiring enthusiastic data scientist team members to build and deliver a one-of-a-kind data facility. You'll have the chance to work with clinicians and researchers to achieve the goal of translating institutional information into meaningful insights in order to improve patient care, hospital operations, and clinical research.
About us – Unified Data Fabric
We are developing one of the most robust oncology data ecosystems in all of healthcare, the Unified Data Fabric. The integration of clinical, genomic, operational, and financial data will lead to countless insights, through the integration of high quality, authoritative, discrete, unstructured, streaming, and imaging data, by way of creating a unique and unprecedented healthcare data platform. This data platform will be a combination of cloud and on-prem technologies and will be built on state-of-the-art architecture that includes APIs, object stores, data streaming, image processing, DBMS pipelines and data warehousing technologies, with a foundation of enterprise data governance and stewardship practices including advanced semantics and machine learning to generate more data of value within the Unified Data Fabric.




Closing:",4.1,Memorial Sloan-Kettering Cancer Center,"New York, NY",-1,10000+ Employees,1884,Nonprofit Organization,Health Care Services & Hospitals,Health Care,$2 to $5 billion (USD),-1,0,64,118,91.0, NY,136,0,0,1,0
Research Scientist,64 - 118 ,"Experience investigating the feasibility of applying scientific principals and concepts to business problems and products
MS degree with at least 1 year of research experience in a quantitative field or PHD in a quantitative field
Amazon’s Talent Assessment team designs and implements groundbreaking hiring solutions for one of the world’s fastest growing companies. We work in a fast-paced, global environment where we must solve complex problems (ranging from research-based to technical) and deliver solutions that have impact.

We are seeking personnel selection researchers with a foundation in the development of pre-hire selection assessments, traditional and alternative legally defensible assessment validation approaches, research methodology, and data analysis. We are looking for equal parts researchers and consultant who are highly adaptable and continual learners who thrive in a fast-paced environment.

In this role, you will develop, implement, and optimize assessment solutions, allowing Amazon’s business to grow and scale. You will partner closely with their recruiting and business teams to design and experiment with new hiring solutions that predict success for roles that will have a large impact at Amazon.",3.8,Canary - US,"Arlington, VA",-1,10000+ Employees,1994,Company - Public,Internet,Information Technology,$10+ billion (USD),-1,0,64,118,91.0, VA,26,0,0,0,0
